{
  "$ref": "#/definitions/projects",
  "definitions": {
    "projects": {
      "type": "object",
      "properties": {
        "title": {
          "type": "string"
        },
        "description": {
          "type": "string"
        },
        "sourceUrl": {
          "type": "string"
        },
        "startDate": {
          "anyOf": [
            {
              "type": "string",
              "format": "date-time"
            },
            {
              "type": "string",
              "format": "date"
            },
            {
              "type": "integer",
              "format": "unix-time"
            }
          ]
        },
        "tags": {
          "type": "array",
          "items": {
            "type": "string"
          },
          "default": []
        },
        "active": {
          "type": "boolean",
          "default": true
        },
        "featurable": {
          "type": "boolean",
          "default": true
        },
        "$schema": {
          "type": "string"
        }
      },
      "required": [
        "title",
        "sourceUrl"
      ],
      "additionalProperties": false
    }
  },
  "$schema": "http://json-schema.org/draft-07/schema#"
}